{
  "schemaVersion": "drama-studio/corpus-manifest/v0",
  "generatedAt": "2026-10-15T08:00:00+00:00",
  "episodes": [
    {
      "templateId": "TPL-TOWN-01",
      "episodeIndex": 2,
      "snapshotId": null,
      "fetchedAt": "2026-10-15T07:58:00+00:00",
      "source": "local_export"
    }
  ],
  "readCalls": {
    "total": 1,
    "failures": 0,
    "billing": "not_observed"
  }
}
